{
  "schema_version": "2.0",
  "manifest_kind": "production",
  "course": "hs-world-history",
  "unit": "unit-01",
  "generated_at": "2026-08-02T21:00:00Z",
  "records": [
    {
      "asset_id": "hs-world-history-unit-01-w-02-magna-carta-text",
      "course": "hs-world-history",
      "unit": "unit-01",
      "standard": "W.02",
      "asset_type": "canonical_html",
      "title": "Magna Carta (1215)",
      "creator_or_institution": "King John and the barons of England",
      "date": "1215",
      "repository": "Avalon Project, Yale Law School",
      "exact_item_id": "medieval/magna",
      "source_page_url": "https://avalon.law.yale.edu/medieval/magna.asp",
      "direct_download_url": "",
      "delivery_kind": "canonical_html",
      "target_filename": "W.02_magna-carta-1215.html",
      "drive_subfolder": "HS World History/Unit 01/W.02",
      "license": "Public domain official document text",
      "rights_basis": "official_document_text",
      "rights_url": "https://avalon.law.yale.edu/medieval/magna.asp",
      "attribution": "Magna Carta, 1215. Avalon Project, Yale Law School.",
      "commercial_use_ok": true,
      "compound_request": false,
      "asset_count": 1,
      "expected_mime_type": "text/html",
      "detected_mime_type": "text/html",
      "retrieval_method": "canonical_html",
      "retrieval_status": "success",
      "retrieval_tested_at": "2026-08-02T21:00:00Z",
      "source_verified_at": "2026-08-02T21:00:00Z",
      "http_status": 200,
      "downloaded_bytes": 1000,
      "content_sha256": "aaaaaaaaaaaaaaaaaaaaaaaaaaaaaaaaaaaaaaaaaaaaaaaaaaaaaaaaaaaaaaaa",
      "file_signature_valid": true,
      "image_width": null,
      "image_height": null,
      "verified": true,
      "readiness_tier": "GREEN",
      "review_reason": "production-ready",
      "source_warning": ""
    }
  ]
}

